{
  "schema_version": 1,
  "verification_status": "candidate",
  "package": {
    "version": "REPLACE_WITH_INSTALLED_RELEASE_VERSION",
    "source_identity": {
      "repository": "REPLACE_WITH_SOURCE_REPOSITORY",
      "commit": "0000000000000000000000000000000000000000"
    },
    "archive_sha256": "0000000000000000000000000000000000000000000000000000000000000000",
    "inventory_sha256": "0000000000000000000000000000000000000000000000000000000000000000"
  },
  "instance_root_reference": {
    "object_id": "REPLACE_WITH_PRIVATE_INSTANCE_ROOT",
    "kind": "folder",
    "permitted_ancestor_id": "REPLACE_WITH_PRIVATE_INSTANCE_ROOT"
  },
  "installation_manifest_reference": {
    "object_id": "REPLACE_WITH_PRIVATE_INSTALLATION_MANIFEST",
    "kind": "file",
    "permitted_ancestor_id": "REPLACE_WITH_PRIVATE_INSTANCE_ROOT"
  },
  "files": {}
}
